

================================================================
== Vitis HLS Report for 'case_3_Pipeline_L_n9_1_L_n9_2'
================================================================
* Date:           Tue Jan 20 09:52:11 2026

* Version:        2025.1 (Build 6135595 on May 21 2025)
* Project:        project_tmp
* Solution:       solution_tmp (Vivado IP Flow Target)
* Product family: zynq
* Target device:  xc7z020-clg484-1


================================================================
== Performance Estimates
================================================================
+ Timing: 
    * Summary: 
    +--------+----------+----------+------------+
    |  Clock |  Target  | Estimated| Uncertainty|
    +--------+----------+----------+------------+
    |ap_clk  |  12.00 ns|  7.670 ns|     3.24 ns|
    +--------+----------+----------+------------+

+ Latency: 
    * Summary: 
    +---------+---------+----------+----------+-----+-----+------------------------------------------------+
    |  Latency (cycles) |  Latency (absolute) |  Interval |                    Pipeline                    |
    |   min   |   max   |    min   |    max   | min | max |                      Type                      |
    +---------+---------+----------+----------+-----+-----+------------------------------------------------+
    |       67|       67|  0.804 us|  0.804 us|   65|   65|  loop auto-rewind stp (delay=0 clock cycles(s))|
    +---------+---------+----------+----------+-----+-----+------------------------------------------------+

    + Detail: 
        * Instance: 
        N/A

        * Loop: 
        +-----------------+---------+---------+----------+-----------+-----------+------+----------+
        |                 |  Latency (cycles) | Iteration|  Initiation Interval  | Trip |          |
        |    Loop Name    |   min   |   max   |  Latency |  achieved |   target  | Count| Pipelined|
        +-----------------+---------+---------+----------+-----------+-----------+------+----------+
        |- L_n9_1_L_n9_2  |       65|       65|         3|          1|          1|    64|       yes|
        +-----------------+---------+---------+----------+-----------+-----------+------+----------+

============================================================
+ Verbose Summary: Synthesis Manager
============================================================
InlineROM: 1
ExposeGlobal: 0
============================================================
+ Verbose Summary: CDFG Model
============================================================
IsTopModel: 0
ResetActiveHigh: 1
IsCombinational: 0
IsDatapathOnly: 0
HasWiredReturn: 1
HasMFsm: 2
HasVarLatency: 1
IsPipeline: 0
IsRtlPipelined: 0
IsInstanceOverlapped: 0
IsDontTouch: 0
HasImplIP: 0
IsGatedGlobalClock: 0

+ Individual pipeline summary: 
  * Pipeline-0: initiation interval (II) = 1, depth = 3


============================================================
+ Verbose Summary: Schedule
============================================================
* Number of FSM states : 3
* Pipeline : 1
  Pipeline-0 : II = 1, D = 3, States = { 1 2 3 }
* Dataflow Pipeline: 0

* FSM state transitions: 
1 --> 2 
2 --> 3 
3 --> 

* FSM state operations: 

State 1 <SV = 0> <Delay = 7.67>
ST_1 : Operation 6 [1/1] (0.00ns)   --->   "%m27 = alloca i32 1" [case_3.cc:22]   --->   Operation 6 'alloca' 'm27' <Predicate = true> <Delay = 0.00>
ST_1 : Operation 7 [1/1] (0.00ns)   --->   "%i_n9_1 = alloca i32 1" [case_3.cc:219]   --->   Operation 7 'alloca' 'i_n9_1' <Predicate = true> <Delay = 0.00>
ST_1 : Operation 8 [1/1] (0.00ns)   --->   "%indvar_flatten89 = alloca i32 1"   --->   Operation 8 'alloca' 'indvar_flatten89' <Predicate = true> <Delay = 0.00>
ST_1 : Operation 9 [1/1] (0.00ns)   --->   "%sext_ln220_read = read i4 @_ssdm_op_Read.ap_auto.i4, i4 %sext_ln220"   --->   Operation 9 'read' 'sext_ln220_read' <Predicate = true> <Delay = 0.00>
ST_1 : Operation 10 [1/1] (0.00ns)   --->   "%m27_13_reload_read = read i16 @_ssdm_op_Read.ap_auto.i16, i16 %m27_13_reload"   --->   Operation 10 'read' 'm27_13_reload_read' <Predicate = true> <Delay = 0.00>
ST_1 : Operation 11 [1/1] (0.00ns)   --->   "%sext_ln220_cast = sext i4 %sext_ln220_read"   --->   Operation 11 'sext' 'sext_ln220_cast' <Predicate = true> <Delay = 0.00>
ST_1 : Operation 12 [1/1] (0.00ns)   --->   "%specinterface_ln0 = specinterface void @_ssdm_op_SpecInterface, i8 %in_data_2, void @empty, i32 0, i32 0, void @empty_5, i32 4294967295, i32 0, void @empty_5, void @empty_5, void @empty_5, i32 0, i32 0, i32 0, i32 0, void @empty_5, void @empty_5, i32 4294967295, i32 0, i32 0"   --->   Operation 12 'specinterface' 'specinterface_ln0' <Predicate = true> <Delay = 0.00>
ST_1 : Operation 13 [1/1] (1.58ns)   --->   "%store_ln0 = store i7 0, i7 %indvar_flatten89"   --->   Operation 13 'store' 'store_ln0' <Predicate = true> <Delay = 1.58>
ST_1 : Operation 14 [1/1] (1.58ns)   --->   "%store_ln219 = store i4 0, i4 %i_n9_1" [case_3.cc:219]   --->   Operation 14 'store' 'store_ln219' <Predicate = true> <Delay = 1.58>
ST_1 : Operation 15 [1/1] (1.58ns)   --->   "%store_ln22 = store i16 %m27_13_reload_read, i16 %m27" [case_3.cc:22]   --->   Operation 15 'store' 'store_ln22' <Predicate = true> <Delay = 1.58>
ST_1 : Operation 16 [1/1] (0.00ns)   --->   "%br_ln0 = br void %for.inc702"   --->   Operation 16 'br' 'br_ln0' <Predicate = true> <Delay = 0.00>
ST_1 : Operation 17 [1/1] (0.00ns)   --->   "%indvar_flatten89_load = load i7 %indvar_flatten89" [case_3.cc:218]   --->   Operation 17 'load' 'indvar_flatten89_load' <Predicate = true> <Delay = 0.00>
ST_1 : Operation 18 [1/1] (1.87ns)   --->   "%icmp_ln218 = icmp_eq  i7 %indvar_flatten89_load, i7 64" [case_3.cc:218]   --->   Operation 18 'icmp' 'icmp_ln218' <Predicate = true> <Delay = 1.87> <CoreInst = "Cmp">   --->   Core 9 'Cmp' <Latency = 0> <II = 1> <Delay = 1.87> <FuncUnit> <Opcode : 'seteq' 'setne' 'setle' 'setge' 'setlt' 'setgt'> <InPorts = 2> <OutPorts = 1>
ST_1 : Operation 19 [1/1] (1.87ns)   --->   "%add_ln218 = add i7 %indvar_flatten89_load, i7 1" [case_3.cc:218]   --->   Operation 19 'add' 'add_ln218' <Predicate = true> <Delay = 1.87> <CoreInst = "Adder">   --->   Core 1 'Adder' <Latency = 0> <II = 1> <Delay = 1.87> <FuncUnit> <Opcode : 'add' 'sub'> <InPorts = 2> <OutPorts = 1>
ST_1 : Operation 20 [1/1] (0.00ns)   --->   "%br_ln218 = br i1 %icmp_ln218, void %for.inc705, void %for.cond.cleanup677.exitStub" [case_3.cc:218]   --->   Operation 20 'br' 'br_ln218' <Predicate = true> <Delay = 0.00>
ST_1 : Operation 21 [1/1] (0.00ns)   --->   "%i_n9_1_load = load i4 %i_n9_1" [case_3.cc:219]   --->   Operation 21 'load' 'i_n9_1_load' <Predicate = (!icmp_ln218)> <Delay = 0.00>
ST_1 : Operation 22 [1/1] (1.73ns)   --->   "%icmp_ln219 = icmp_eq  i4 %i_n9_1_load, i4 8" [case_3.cc:219]   --->   Operation 22 'icmp' 'icmp_ln219' <Predicate = (!icmp_ln218)> <Delay = 1.73> <CoreInst = "Cmp">   --->   Core 9 'Cmp' <Latency = 0> <II = 1> <Delay = 1.73> <FuncUnit> <Opcode : 'seteq' 'setne' 'setle' 'setge' 'setlt' 'setgt'> <InPorts = 2> <OutPorts = 1>
ST_1 : Operation 23 [1/1] (1.02ns)   --->   "%select_ln22 = select i1 %icmp_ln219, i4 0, i4 %i_n9_1_load" [case_3.cc:22]   --->   Operation 23 'select' 'select_ln22' <Predicate = (!icmp_ln218)> <Delay = 1.02> <CoreInst = "Sel">   --->   Core 73 'Sel' <Latency = 0> <II = 1> <Delay = 1.02> <FuncUnit> <Opcode : 'select'> <InPorts = 3> <OutPorts = 1>
ST_1 : Operation 24 [1/1] (0.00ns)   --->   "%zext_ln219 = zext i4 %select_ln22" [case_3.cc:219]   --->   Operation 24 'zext' 'zext_ln219' <Predicate = (!icmp_ln218)> <Delay = 0.00>
ST_1 : Operation 25 [1/1] (0.00ns)   --->   "%in_data_2_addr = getelementptr i8 %in_data_2, i64 0, i64 %zext_ln219" [case_3.cc:220]   --->   Operation 25 'getelementptr' 'in_data_2_addr' <Predicate = (!icmp_ln218)> <Delay = 0.00>
ST_1 : Operation 26 [2/2] (2.32ns)   --->   "%in_data_2_load = load i4 %in_data_2_addr" [case_3.cc:220]   --->   Operation 26 'load' 'in_data_2_load' <Predicate = (!icmp_ln218)> <Delay = 2.32> <CoreInst = "RAM">   --->   Core 81 'RAM' <Latency = 1> <II = 1> <Delay = 2.32> <Storage> <Opcode : 'load' 'store'> <Ports = 2> <Width = 8> <Depth = 16> <RAM>
ST_1 : Operation 27 [1/1] (1.73ns)   --->   "%add_ln219 = add i4 %select_ln22, i4 1" [case_3.cc:219]   --->   Operation 27 'add' 'add_ln219' <Predicate = (!icmp_ln218)> <Delay = 1.73> <CoreInst = "Adder">   --->   Core 1 'Adder' <Latency = 0> <II = 1> <Delay = 1.73> <FuncUnit> <Opcode : 'add' 'sub'> <InPorts = 2> <OutPorts = 1>
ST_1 : Operation 28 [1/1] (1.58ns)   --->   "%store_ln218 = store i7 %add_ln218, i7 %indvar_flatten89" [case_3.cc:218]   --->   Operation 28 'store' 'store_ln218' <Predicate = (!icmp_ln218)> <Delay = 1.58>
ST_1 : Operation 29 [1/1] (1.58ns)   --->   "%store_ln219 = store i4 %add_ln219, i4 %i_n9_1" [case_3.cc:219]   --->   Operation 29 'store' 'store_ln219' <Predicate = (!icmp_ln218)> <Delay = 1.58>

State 2 <SV = 1> <Delay = 6.49>
ST_2 : Operation 30 [1/2] ( I:2.32ns O:2.32ns )   --->   "%in_data_2_load = load i4 %in_data_2_addr" [case_3.cc:220]   --->   Operation 30 'load' 'in_data_2_load' <Predicate = true> <Delay = 2.32> <CoreInst = "RAM">   --->   Core 81 'RAM' <Latency = 1> <II = 1> <Delay = 2.32> <Storage> <Opcode : 'load' 'store'> <Ports = 2> <Width = 8> <Depth = 16> <RAM>
ST_2 : Operation 31 [1/1] (0.00ns)   --->   "%sext_ln220_1 = sext i8 %in_data_2_load" [case_3.cc:220]   --->   Operation 31 'sext' 'sext_ln220_1' <Predicate = true> <Delay = 0.00>
ST_2 : Operation 32 [1/1] (4.17ns)   --->   "%m105 = mul i10 %sext_ln220_1, i10 %sext_ln220_cast" [case_3.cc:220]   --->   Operation 32 'mul' 'm105' <Predicate = true> <Delay = 4.17> <CoreInst = "Multiplier">   --->   Core 3 'Multiplier' <Latency = 0> <II = 1> <Delay = 4.17> <FuncUnit> <Opcode : 'mul'> <InPorts = 2> <OutPorts = 1>
ST_2 : Operation 41 [1/1] (0.00ns)   --->   "%m27_load = load i16 %m27"   --->   Operation 41 'load' 'm27_load' <Predicate = (icmp_ln218)> <Delay = 0.00>
ST_2 : Operation 42 [1/1] (0.00ns)   --->   "%write_ln0 = write void @_ssdm_op_Write.ap_auto.i16P0A, i16 %m27_15_out, i16 %m27_load"   --->   Operation 42 'write' 'write_ln0' <Predicate = (icmp_ln218)> <Delay = 0.00>
ST_2 : Operation 43 [1/1] (1.58ns)   --->   "%ret_ln0 = ret"   --->   Operation 43 'ret' 'ret_ln0' <Predicate = (icmp_ln218)> <Delay = 1.58>

State 3 <SV = 2> <Delay = 3.66>
ST_3 : Operation 33 [1/1] (0.00ns)   --->   "%m27_load_3 = load i16 %m27" [case_3.cc:222]   --->   Operation 33 'load' 'm27_load_3' <Predicate = true> <Delay = 0.00>
ST_3 : Operation 34 [1/1] (0.00ns)   --->   "%specloopname_ln0 = specloopname void @_ssdm_op_SpecLoopName, void @L_n9_1_L_n9_2_str"   --->   Operation 34 'specloopname' 'specloopname_ln0' <Predicate = true> <Delay = 0.00>
ST_3 : Operation 35 [1/1] (0.00ns)   --->   "%speclooptripcount_ln0 = speclooptripcount void @_ssdm_op_SpecLoopTripCount, i64 64, i64 64, i64 64"   --->   Operation 35 'speclooptripcount' 'speclooptripcount_ln0' <Predicate = true> <Delay = 0.00>
ST_3 : Operation 36 [1/1] (0.00ns)   --->   "%specpipeline_ln22 = specpipeline void @_ssdm_op_SpecPipeline, i32 4294967295, i32 0, i32 0, i32 0, void @empty_5" [case_3.cc:22]   --->   Operation 36 'specpipeline' 'specpipeline_ln22' <Predicate = true> <Delay = 0.00>
ST_3 : Operation 37 [1/1] (0.00ns)   --->   "%sext_ln222 = sext i10 %m105" [case_3.cc:222]   --->   Operation 37 'sext' 'sext_ln222' <Predicate = true> <Delay = 0.00>
ST_3 : Operation 38 [1/1] (2.07ns)   --->   "%m27_4 = add i16 %sext_ln222, i16 %m27_load_3" [case_3.cc:222]   --->   Operation 38 'add' 'm27_4' <Predicate = true> <Delay = 2.07> <CoreInst = "Adder">   --->   Core 1 'Adder' <Latency = 0> <II = 1> <Delay = 2.07> <FuncUnit> <Opcode : 'add' 'sub'> <InPorts = 2> <OutPorts = 1>
ST_3 : Operation 39 [1/1] (1.58ns)   --->   "%store_ln22 = store i16 %m27_4, i16 %m27" [case_3.cc:22]   --->   Operation 39 'store' 'store_ln22' <Predicate = true> <Delay = 1.58>
ST_3 : Operation 40 [1/1] (0.00ns)   --->   "%br_ln219 = br void %for.inc702" [case_3.cc:219]   --->   Operation 40 'br' 'br_ln219' <Predicate = true> <Delay = 0.00>


============================================================
+ Verbose Summary: Timing violations
============================================================
Target clock period: 12.000ns, clock uncertainty: 3.240ns.

 <State 1>: 7.670ns
The critical path consists of the following:
	'store' operation 0 bit ('store_ln219', case_3.cc:219) of constant 0 on local variable 'i_n9_1', case_3.cc:219 [13]  (1.588 ns)
	'load' operation 4 bit ('i_n9_1_load', case_3.cc:219) on local variable 'i_n9_1', case_3.cc:219 [23]  (0.000 ns)
	'icmp' operation 1 bit ('icmp_ln219', case_3.cc:219) [26]  (1.735 ns)
	'select' operation 4 bit ('select_ln22', case_3.cc:22) [27]  (1.024 ns)
	'add' operation 4 bit ('add_ln219', case_3.cc:219) [36]  (1.735 ns)
	'store' operation 0 bit ('store_ln219', case_3.cc:219) of variable 'add_ln219', case_3.cc:219 on local variable 'i_n9_1', case_3.cc:219 [38]  (1.588 ns)

 <State 2>: 6.492ns
The critical path consists of the following:
	'load' operation 8 bit ('in_data_2_load', case_3.cc:220) on array 'in_data_2' [31]  (2.322 ns)
	'mul' operation 10 bit ('m105', case_3.cc:220) [33]  (4.170 ns)

 <State 3>: 3.665ns
The critical path consists of the following:
	'load' operation 16 bit ('m27_load_3', case_3.cc:222) on local variable 'm27', case_3.cc:22 [22]  (0.000 ns)
	'add' operation 16 bit ('m27_4', case_3.cc:222) [35]  (2.077 ns)
	'store' operation 0 bit ('store_ln22', case_3.cc:22) of variable 'm27_4', case_3.cc:222 on local variable 'm27', case_3.cc:22 [39]  (1.588 ns)


============================================================
+ Verbose Summary: Binding
============================================================
N/A
* FSMD analyzer results:
  - Output states:
 - Input state : 
  - Chain level:
	State 1
	State 2
	State 3


============================================================
+ Verbose Summary: Datapath Resource usage 
============================================================
N/A
