

================================================================
== Vitis HLS Report for 'case_3_Pipeline_L_n4_1_L_n4_2_L_n4_3'
================================================================
* Date:           Tue Jan 20 09:52:10 2026

* Version:        2025.1 (Build 6135595 on May 21 2025)
* Project:        project_tmp
* Solution:       solution_tmp (Vivado IP Flow Target)
* Product family: zynq
* Target device:  xc7z020-clg484-1


================================================================
== Performance Estimates
================================================================
+ Timing: 
    * Summary: 
    +--------+----------+----------+------------+
    |  Clock |  Target  | Estimated| Uncertainty|
    +--------+----------+----------+------------+
    |ap_clk  |  12.00 ns|  7.850 ns|     3.24 ns|
    +--------+----------+----------+------------+

+ Latency: 
    * Summary: 
    +---------+---------+----------+----------+-----+-----+------------------------------------------------+
    |  Latency (cycles) |  Latency (absolute) |  Interval |                    Pipeline                    |
    |   min   |   max   |    min   |    max   | min | max |                      Type                      |
    +---------+---------+----------+----------+-----+-----+------------------------------------------------+
    |      515|      515|  6.180 us|  6.180 us|  513|  513|  loop auto-rewind stp (delay=0 clock cycles(s))|
    +---------+---------+----------+----------+-----+-----+------------------------------------------------+

    + Detail: 
        * Instance: 
        N/A

        * Loop: 
        +------------------------+---------+---------+----------+-----------+-----------+------+----------+
        |                        |  Latency (cycles) | Iteration|  Initiation Interval  | Trip |          |
        |        Loop Name       |   min   |   max   |  Latency |  achieved |   target  | Count| Pipelined|
        +------------------------+---------+---------+----------+-----------+-----------+------+----------+
        |- L_n4_1_L_n4_2_L_n4_3  |      513|      513|         3|          1|          1|   512|       yes|
        +------------------------+---------+---------+----------+-----------+-----------+------+----------+

============================================================
+ Verbose Summary: Synthesis Manager
============================================================
InlineROM: 1
ExposeGlobal: 0
============================================================
+ Verbose Summary: CDFG Model
============================================================
IsTopModel: 0
ResetActiveHigh: 1
IsCombinational: 0
IsDatapathOnly: 0
HasWiredReturn: 1
HasMFsm: 2
HasVarLatency: 1
IsPipeline: 0
IsRtlPipelined: 0
IsInstanceOverlapped: 0
IsDontTouch: 0
HasImplIP: 0
IsGatedGlobalClock: 0

+ Individual pipeline summary: 
  * Pipeline-0: initiation interval (II) = 1, depth = 3


============================================================
+ Verbose Summary: Schedule
============================================================
* Number of FSM states : 3
* Pipeline : 1
  Pipeline-0 : II = 1, D = 3, States = { 1 2 3 }
* Dataflow Pipeline: 0

* FSM state transitions: 
1 --> 2 
2 --> 3 
3 --> 

* FSM state operations: 

State 1 <SV = 0> <Delay = 7.85>
ST_1 : Operation 6 [1/1] (0.00ns)   --->   "%m124 = alloca i32 1"   --->   Operation 6 'alloca' 'm124' <Predicate = true> <Delay = 0.00>
ST_1 : Operation 7 [1/1] (0.00ns)   --->   "%m27_3 = alloca i32 1" [case_3.cc:22]   --->   Operation 7 'alloca' 'm27_3' <Predicate = true> <Delay = 0.00>
ST_1 : Operation 8 [1/1] (0.00ns)   --->   "%i_n4_2 = alloca i32 1" [case_3.cc:133]   --->   Operation 8 'alloca' 'i_n4_2' <Predicate = true> <Delay = 0.00>
ST_1 : Operation 9 [1/1] (0.00ns)   --->   "%indvar_flatten28 = alloca i32 1"   --->   Operation 9 'alloca' 'indvar_flatten28' <Predicate = true> <Delay = 0.00>
ST_1 : Operation 10 [1/1] (0.00ns)   --->   "%indvar_flatten43 = alloca i32 1"   --->   Operation 10 'alloca' 'indvar_flatten43' <Predicate = true> <Delay = 0.00>
ST_1 : Operation 11 [1/1] (0.00ns)   --->   "%sext_ln22_read = read i4 @_ssdm_op_Read.ap_auto.i4, i4 %sext_ln22"   --->   Operation 11 'read' 'sext_ln22_read' <Predicate = true> <Delay = 0.00>
ST_1 : Operation 12 [1/1] (0.00ns)   --->   "%sext_ln131_read = read i4 @_ssdm_op_Read.ap_auto.i4, i4 %sext_ln131"   --->   Operation 12 'read' 'sext_ln131_read' <Predicate = true> <Delay = 0.00>
ST_1 : Operation 13 [1/1] (0.00ns)   --->   "%conv_i3873_cast_read = read i5 @_ssdm_op_Read.ap_auto.i5, i5 %conv_i3873_cast"   --->   Operation 13 'read' 'conv_i3873_cast_read' <Predicate = true> <Delay = 0.00>
ST_1 : Operation 14 [1/1] (0.00ns)   --->   "%m27_2_reload_read = read i16 @_ssdm_op_Read.ap_auto.i16, i16 %m27_2_reload"   --->   Operation 14 'read' 'm27_2_reload_read' <Predicate = true> <Delay = 0.00>
ST_1 : Operation 15 [1/1] (0.00ns)   --->   "%sext_ln22_cast = sext i4 %sext_ln22_read"   --->   Operation 15 'sext' 'sext_ln22_cast' <Predicate = true> <Delay = 0.00>
ST_1 : Operation 16 [1/1] (0.00ns)   --->   "%sext_ln131_cast = sext i4 %sext_ln131_read"   --->   Operation 16 'sext' 'sext_ln131_cast' <Predicate = true> <Delay = 0.00>
ST_1 : Operation 17 [1/1] (0.00ns)   --->   "%conv_i3873_cast_cast = sext i5 %conv_i3873_cast_read"   --->   Operation 17 'sext' 'conv_i3873_cast_cast' <Predicate = true> <Delay = 0.00>
ST_1 : Operation 18 [1/1] (0.00ns)   --->   "%specinterface_ln0 = specinterface void @_ssdm_op_SpecInterface, i8 %in_data_12, void @empty, i32 0, i32 0, void @empty_5, i32 4294967295, i32 0, void @empty_5, void @empty_5, void @empty_5, i32 0, i32 0, i32 0, i32 0, void @empty_5, void @empty_5, i32 4294967295, i32 0, i32 0"   --->   Operation 18 'specinterface' 'specinterface_ln0' <Predicate = true> <Delay = 0.00>
ST_1 : Operation 19 [1/1] (1.58ns)   --->   "%store_ln0 = store i10 0, i10 %indvar_flatten43"   --->   Operation 19 'store' 'store_ln0' <Predicate = true> <Delay = 1.58>
ST_1 : Operation 20 [1/1] (1.58ns)   --->   "%store_ln0 = store i8 0, i8 %indvar_flatten28"   --->   Operation 20 'store' 'store_ln0' <Predicate = true> <Delay = 1.58>
ST_1 : Operation 21 [1/1] (1.58ns)   --->   "%store_ln133 = store i4 0, i4 %i_n4_2" [case_3.cc:133]   --->   Operation 21 'store' 'store_ln133' <Predicate = true> <Delay = 1.58>
ST_1 : Operation 22 [1/1] (1.58ns)   --->   "%store_ln22 = store i16 %m27_2_reload_read, i16 %m27_3" [case_3.cc:22]   --->   Operation 22 'store' 'store_ln22' <Predicate = true> <Delay = 1.58>
ST_1 : Operation 23 [1/1] (0.00ns)   --->   "%br_ln0 = br void %for.inc250"   --->   Operation 23 'br' 'br_ln0' <Predicate = true> <Delay = 0.00>
ST_1 : Operation 24 [1/1] (0.00ns)   --->   "%indvar_flatten43_load = load i10 %indvar_flatten43" [case_3.cc:131]   --->   Operation 24 'load' 'indvar_flatten43_load' <Predicate = true> <Delay = 0.00>
ST_1 : Operation 25 [1/1] (1.73ns)   --->   "%icmp_ln131 = icmp_eq  i10 %indvar_flatten43_load, i10 512" [case_3.cc:131]   --->   Operation 25 'icmp' 'icmp_ln131' <Predicate = true> <Delay = 1.73> <CoreInst = "Cmp">   --->   Core 9 'Cmp' <Latency = 0> <II = 1> <Delay = 1.73> <FuncUnit> <Opcode : 'seteq' 'setne' 'setle' 'setge' 'setlt' 'setgt'> <InPorts = 2> <OutPorts = 1>
ST_1 : Operation 26 [1/1] (1.73ns)   --->   "%add_ln131 = add i10 %indvar_flatten43_load, i10 1" [case_3.cc:131]   --->   Operation 26 'add' 'add_ln131' <Predicate = true> <Delay = 1.73> <CoreInst = "Adder">   --->   Core 1 'Adder' <Latency = 0> <II = 1> <Delay = 1.73> <FuncUnit> <Opcode : 'add' 'sub'> <InPorts = 2> <OutPorts = 1>
ST_1 : Operation 27 [1/1] (0.00ns)   --->   "%br_ln131 = br i1 %icmp_ln131, void %for.inc256, void %for.cond.cleanup205.exitStub" [case_3.cc:131]   --->   Operation 27 'br' 'br_ln131' <Predicate = true> <Delay = 0.00>
ST_1 : Operation 28 [1/1] (0.00ns)   --->   "%i_n4_2_load = load i4 %i_n4_2" [case_3.cc:133]   --->   Operation 28 'load' 'i_n4_2_load' <Predicate = (!icmp_ln131)> <Delay = 0.00>
ST_1 : Operation 29 [1/1] (0.00ns)   --->   "%indvar_flatten28_load = load i8 %indvar_flatten28" [case_3.cc:132]   --->   Operation 29 'load' 'indvar_flatten28_load' <Predicate = (!icmp_ln131)> <Delay = 0.00>
ST_1 : Operation 30 [1/1] (1.91ns)   --->   "%icmp_ln132 = icmp_eq  i8 %indvar_flatten28_load, i8 64" [case_3.cc:132]   --->   Operation 30 'icmp' 'icmp_ln132' <Predicate = (!icmp_ln131)> <Delay = 1.91> <CoreInst = "Cmp">   --->   Core 9 'Cmp' <Latency = 0> <II = 1> <Delay = 1.91> <FuncUnit> <Opcode : 'seteq' 'setne' 'setle' 'setge' 'setlt' 'setgt'> <InPorts = 2> <OutPorts = 1>
ST_1 : Operation 31 [1/1] (0.00ns) (grouped into LUT with out node select_ln22)   --->   "%xor_ln22 = xor i1 %icmp_ln132, i1 1" [case_3.cc:22]   --->   Operation 31 'xor' 'xor_ln22' <Predicate = (!icmp_ln131)> <Delay = 0.00> <CoreInst = "LogicGate">   --->   Core 74 'LogicGate' <Latency = 0> <II = 1> <Delay = 0.97> <FuncUnit> <Opcode : 'and' 'or' 'xor'> <InPorts = 2> <OutPorts = 1>
ST_1 : Operation 32 [1/1] (1.73ns)   --->   "%icmp_ln133 = icmp_eq  i4 %i_n4_2_load, i4 8" [case_3.cc:133]   --->   Operation 32 'icmp' 'icmp_ln133' <Predicate = (!icmp_ln131)> <Delay = 1.73> <CoreInst = "Cmp">   --->   Core 9 'Cmp' <Latency = 0> <II = 1> <Delay = 1.73> <FuncUnit> <Opcode : 'seteq' 'setne' 'setle' 'setge' 'setlt' 'setgt'> <InPorts = 2> <OutPorts = 1>
ST_1 : Operation 33 [1/1] (0.00ns) (grouped into LUT with out node select_ln22)   --->   "%and_ln22 = and i1 %icmp_ln133, i1 %xor_ln22" [case_3.cc:22]   --->   Operation 33 'and' 'and_ln22' <Predicate = (!icmp_ln131)> <Delay = 0.00> <CoreInst = "LogicGate">   --->   Core 74 'LogicGate' <Latency = 0> <II = 1> <Delay = 0.97> <FuncUnit> <Opcode : 'and' 'or' 'xor'> <InPorts = 2> <OutPorts = 1>
ST_1 : Operation 34 [1/1] (0.00ns) (grouped into LUT with out node select_ln22)   --->   "%or_ln22 = or i1 %and_ln22, i1 %icmp_ln132" [case_3.cc:22]   --->   Operation 34 'or' 'or_ln22' <Predicate = (!icmp_ln131)> <Delay = 0.00> <CoreInst = "LogicGate">   --->   Core 74 'LogicGate' <Latency = 0> <II = 1> <Delay = 0.97> <FuncUnit> <Opcode : 'and' 'or' 'xor'> <InPorts = 2> <OutPorts = 1>
ST_1 : Operation 35 [1/1] (1.02ns) (out node of the LUT)   --->   "%select_ln22 = select i1 %or_ln22, i4 0, i4 %i_n4_2_load" [case_3.cc:22]   --->   Operation 35 'select' 'select_ln22' <Predicate = (!icmp_ln131)> <Delay = 1.02> <CoreInst = "Sel">   --->   Core 73 'Sel' <Latency = 0> <II = 1> <Delay = 1.02> <FuncUnit> <Opcode : 'select'> <InPorts = 3> <OutPorts = 1>
ST_1 : Operation 36 [1/1] (0.00ns)   --->   "%zext_ln133 = zext i4 %select_ln22" [case_3.cc:133]   --->   Operation 36 'zext' 'zext_ln133' <Predicate = (!icmp_ln131)> <Delay = 0.00>
ST_1 : Operation 37 [1/1] (0.00ns)   --->   "%in_data_12_addr = getelementptr i8 %in_data_12, i64 0, i64 %zext_ln133" [case_3.cc:138]   --->   Operation 37 'getelementptr' 'in_data_12_addr' <Predicate = (!icmp_ln131)> <Delay = 0.00>
ST_1 : Operation 38 [2/2] (2.32ns)   --->   "%in_data_12_load = load i4 %in_data_12_addr" [case_3.cc:138]   --->   Operation 38 'load' 'in_data_12_load' <Predicate = (!icmp_ln131)> <Delay = 2.32> <CoreInst = "RAM">   --->   Core 81 'RAM' <Latency = 1> <II = 1> <Delay = 2.32> <Storage> <Opcode : 'load' 'store'> <Ports = 2> <Width = 8> <Depth = 16> <RAM>
ST_1 : Operation 39 [1/1] (1.73ns)   --->   "%add_ln133 = add i4 %select_ln22, i4 1" [case_3.cc:133]   --->   Operation 39 'add' 'add_ln133' <Predicate = (!icmp_ln131)> <Delay = 1.73> <CoreInst = "Adder">   --->   Core 1 'Adder' <Latency = 0> <II = 1> <Delay = 1.73> <FuncUnit> <Opcode : 'add' 'sub'> <InPorts = 2> <OutPorts = 1>
ST_1 : Operation 40 [1/1] (1.91ns)   --->   "%add_ln132 = add i8 %indvar_flatten28_load, i8 1" [case_3.cc:132]   --->   Operation 40 'add' 'add_ln132' <Predicate = (!icmp_ln131)> <Delay = 1.91> <CoreInst = "Adder">   --->   Core 1 'Adder' <Latency = 0> <II = 1> <Delay = 1.91> <FuncUnit> <Opcode : 'add' 'sub'> <InPorts = 2> <OutPorts = 1>
ST_1 : Operation 41 [1/1] (1.24ns)   --->   "%select_ln132 = select i1 %icmp_ln132, i8 1, i8 %add_ln132" [case_3.cc:132]   --->   Operation 41 'select' 'select_ln132' <Predicate = (!icmp_ln131)> <Delay = 1.24> <CoreInst = "Sel">   --->   Core 73 'Sel' <Latency = 0> <II = 1> <Delay = 1.24> <FuncUnit> <Opcode : 'select'> <InPorts = 3> <OutPorts = 1>
ST_1 : Operation 42 [1/1] (1.58ns)   --->   "%store_ln131 = store i10 %add_ln131, i10 %indvar_flatten43" [case_3.cc:131]   --->   Operation 42 'store' 'store_ln131' <Predicate = (!icmp_ln131)> <Delay = 1.58>
ST_1 : Operation 43 [1/1] (1.58ns)   --->   "%store_ln132 = store i8 %select_ln132, i8 %indvar_flatten28" [case_3.cc:132]   --->   Operation 43 'store' 'store_ln132' <Predicate = (!icmp_ln131)> <Delay = 1.58>
ST_1 : Operation 44 [1/1] (1.58ns)   --->   "%store_ln133 = store i4 %add_ln133, i4 %i_n4_2" [case_3.cc:133]   --->   Operation 44 'store' 'store_ln133' <Predicate = (!icmp_ln131)> <Delay = 1.58>

State 2 <SV = 1> <Delay = 4.23>
ST_2 : Operation 45 [1/2] ( I:2.32ns O:2.32ns )   --->   "%in_data_12_load = load i4 %in_data_12_addr" [case_3.cc:138]   --->   Operation 45 'load' 'in_data_12_load' <Predicate = true> <Delay = 2.32> <CoreInst = "RAM">   --->   Core 81 'RAM' <Latency = 1> <II = 1> <Delay = 2.32> <Storage> <Opcode : 'load' 'store'> <Ports = 2> <Width = 8> <Depth = 16> <RAM>
ST_2 : Operation 46 [1/1] (0.00ns)   --->   "%sext_ln138 = sext i8 %in_data_12_load" [case_3.cc:138]   --->   Operation 46 'sext' 'sext_ln138' <Predicate = true> <Delay = 0.00>
ST_2 : Operation 47 [1/1] (1.91ns)   --->   "%m56 = add i9 %sext_ln138, i9 %conv_i3873_cast_cast" [case_3.cc:138]   --->   Operation 47 'add' 'm56' <Predicate = true> <Delay = 1.91> <CoreInst = "Adder">   --->   Core 1 'Adder' <Latency = 0> <II = 1> <Delay = 1.91> <FuncUnit> <Opcode : 'add' 'sub'> <InPorts = 2> <OutPorts = 1>
ST_2 : Operation 48 [1/1] (0.00ns)   --->   "%store_ln138 = store i9 %m56, i9 %m124" [case_3.cc:138]   --->   Operation 48 'store' 'store_ln138' <Predicate = true> <Delay = 0.00>
ST_2 : Operation 60 [1/1] (0.00ns)   --->   "%m124_load = load i9 %m124"   --->   Operation 60 'load' 'm124_load' <Predicate = (icmp_ln131)> <Delay = 0.00>
ST_2 : Operation 61 [1/1] (0.00ns)   --->   "%m27_3_load_1 = load i16 %m27_3"   --->   Operation 61 'load' 'm27_3_load_1' <Predicate = (icmp_ln131)> <Delay = 0.00>
ST_2 : Operation 62 [1/1] (0.00ns)   --->   "%write_ln0 = write void @_ssdm_op_Write.ap_auto.i16P0A, i16 %m27_3_out, i16 %m27_3_load_1"   --->   Operation 62 'write' 'write_ln0' <Predicate = (icmp_ln131)> <Delay = 0.00>
ST_2 : Operation 63 [1/1] (0.00ns)   --->   "%write_ln0 = write void @_ssdm_op_Write.ap_auto.i9P0A, i9 %m124_out, i9 %m124_load"   --->   Operation 63 'write' 'write_ln0' <Predicate = (icmp_ln131)> <Delay = 0.00>
ST_2 : Operation 64 [1/1] (1.58ns)   --->   "%ret_ln0 = ret"   --->   Operation 64 'ret' 'ret_ln0' <Predicate = (icmp_ln131)> <Delay = 1.58>

State 3 <SV = 2> <Delay = 7.22>
ST_3 : Operation 49 [1/1] (0.00ns)   --->   "%m27_3_load = load i16 %m27_3" [case_3.cc:139]   --->   Operation 49 'load' 'm27_3_load' <Predicate = true> <Delay = 0.00>
ST_3 : Operation 50 [1/1] (0.00ns)   --->   "%specloopname_ln0 = specloopname void @_ssdm_op_SpecLoopName, void @L_n4_1_L_n4_2_L_n4_3_str"   --->   Operation 50 'specloopname' 'specloopname_ln0' <Predicate = true> <Delay = 0.00>
ST_3 : Operation 51 [1/1] (0.00ns)   --->   "%speclooptripcount_ln0 = speclooptripcount void @_ssdm_op_SpecLoopTripCount, i64 512, i64 512, i64 512"   --->   Operation 51 'speclooptripcount' 'speclooptripcount_ln0' <Predicate = true> <Delay = 0.00>
ST_3 : Operation 52 [1/1] (0.00ns)   --->   "%specpipeline_ln22 = specpipeline void @_ssdm_op_SpecPipeline, i32 4294967295, i32 0, i32 0, i32 0, void @empty_5" [case_3.cc:22]   --->   Operation 52 'specpipeline' 'specpipeline_ln22' <Predicate = true> <Delay = 0.00>
ST_3 : Operation 53 [1/1] (1.73ns)   --->   "%add_ln139 = add i5 %sext_ln131_cast, i5 %sext_ln22_cast" [case_3.cc:139]   --->   Operation 53 'add' 'add_ln139' <Predicate = true> <Delay = 1.73> <CoreInst = "Adder">   --->   Core 1 'Adder' <Latency = 0> <II = 1> <Delay = 1.73> <FuncUnit> <Opcode : 'add' 'sub'> <InPorts = 2> <OutPorts = 1>
ST_3 : Operation 54 [1/1] (0.00ns)   --->   "%sext_ln139 = sext i5 %add_ln139" [case_3.cc:139]   --->   Operation 54 'sext' 'sext_ln139' <Predicate = true> <Delay = 0.00>
ST_3 : Operation 55 [1/1] (1.82ns)   --->   "%add_ln139_1 = add i9 %sext_ln139, i9 %m56" [case_3.cc:139]   --->   Operation 55 'add' 'add_ln139_1' <Predicate = true> <Delay = 1.82> <CoreInst = "Adder">   --->   Core 1 'Adder' <Latency = 0> <II = 1> <Delay = 1.82> <FuncUnit> <Opcode : 'add' 'sub'> <InPorts = 2> <OutPorts = 1>
ST_3 : Operation 56 [1/1] (0.00ns)   --->   "%sext_ln139_1 = sext i9 %add_ln139_1" [case_3.cc:139]   --->   Operation 56 'sext' 'sext_ln139_1' <Predicate = true> <Delay = 0.00>
ST_3 : Operation 57 [1/1] (2.07ns)   --->   "%m27 = add i16 %m27_3_load, i16 %sext_ln139_1" [case_3.cc:139]   --->   Operation 57 'add' 'm27' <Predicate = true> <Delay = 2.07> <CoreInst = "Adder">   --->   Core 1 'Adder' <Latency = 0> <II = 1> <Delay = 2.07> <FuncUnit> <Opcode : 'add' 'sub'> <InPorts = 2> <OutPorts = 1>
ST_3 : Operation 58 [1/1] (1.58ns)   --->   "%store_ln22 = store i16 %m27, i16 %m27_3" [case_3.cc:22]   --->   Operation 58 'store' 'store_ln22' <Predicate = true> <Delay = 1.58>
ST_3 : Operation 59 [1/1] (0.00ns)   --->   "%br_ln133 = br void %for.inc250" [case_3.cc:133]   --->   Operation 59 'br' 'br_ln133' <Predicate = true> <Delay = 0.00>


============================================================
+ Verbose Summary: Timing violations
============================================================
Target clock period: 12.000ns, clock uncertainty: 3.240ns.

 <State 1>: 7.850ns
The critical path consists of the following:
	'store' operation 0 bit ('store_ln0') of constant 0 on local variable 'indvar_flatten28' [22]  (1.588 ns)
	'load' operation 8 bit ('indvar_flatten28_load', case_3.cc:132) on local variable 'indvar_flatten28' [34]  (0.000 ns)
	'icmp' operation 1 bit ('icmp_ln132', case_3.cc:132) [37]  (1.915 ns)
	'or' operation 1 bit ('or_ln22', case_3.cc:22) [41]  (0.000 ns)
	'select' operation 4 bit ('select_ln22', case_3.cc:22) [42]  (1.024 ns)
	'add' operation 4 bit ('add_ln133', case_3.cc:133) [54]  (1.735 ns)
	'store' operation 0 bit ('store_ln133', case_3.cc:133) of variable 'add_ln133', case_3.cc:133 on local variable 'i_n4_2', case_3.cc:133 [59]  (1.588 ns)

 <State 2>: 4.237ns
The critical path consists of the following:
	'load' operation 8 bit ('in_data_12_load', case_3.cc:138) on array 'in_data_12' [46]  (2.322 ns)
	'add' operation 9 bit ('m56', case_3.cc:138) [48]  (1.915 ns)

 <State 3>: 7.223ns
The critical path consists of the following:
	'add' operation 5 bit ('add_ln139', case_3.cc:139) [49]  (1.735 ns)
	'add' operation 9 bit ('add_ln139_1', case_3.cc:139) [51]  (1.823 ns)
	'add' operation 16 bit ('m27', case_3.cc:139) [53]  (2.077 ns)
	'store' operation 0 bit ('store_ln22', case_3.cc:22) of variable 'm27', case_3.cc:139 on local variable 'm27', case_3.cc:22 [60]  (1.588 ns)


============================================================
+ Verbose Summary: Binding
============================================================
N/A
* FSMD analyzer results:
  - Output states:
 - Input state : 
  - Chain level:
	State 1
	State 2
	State 3


============================================================
+ Verbose Summary: Datapath Resource usage 
============================================================
N/A
